{
  "$schema": "http://json-schema.org/draft-07/schema#",
  "$id": "CredentialAgent",
  "title": "Credential Agent",
  "type": "object",
  "properties": {
    "$schema": {
      "type": "string",
      "description": "The schema version of the agent JSON entry"
    },
    "name": {
      "type": "string",
      "description": "The name of the agent"
    },
    "urlWebsite": {
      "type": "string",
      "description": "An URL to the website of the agent with more information",
      "format": "uri"
    },
    "logo": {
      "type": "string",
      "description": "The URL to the logo of the agent"
    },
    "company": {
      "type": "string",
      "description": "The name of the company or a community developing the agent"
    },
    "companyUrl": {
      "type": "string",
      "description": "The url to the company website (not the product website)",
      "format": "uri"
    },
    "contact": {
      "type": "string",
      "description": "A link to a contact form or an email address for support requests"
    },
    "openSource": {
      "type": "boolean",
      "description": "The agent source code is available under an open-source license"
    },
    "downloadSource": {
      "type": "string",
      "description": "The URL to the source code, for example a github repository",
      "format": "uri"
    },
    "license": {
      "type": "string",
      "description": "The license(s) of the agent source code."
    },
    "capability": {
      "type": "array",
      "description": "The capabilities supported by the agent",
      "items": {
        "type": "string",
        "enum": ["holder", "issuer", "verifier"]
      }
    },
    "type": {
      "type": "string",
      "description": "The deployment model of the agent (e.g., cloud service or mobile app)",
      "enum": ["cloud", "mobile"]
    },
    "portability": {
      "type": "boolean",
      "description": "Users can export their data from the agent and import them into another device/system"
    },
    "urlAppStore": {
      "type": "string",
      "description": "Link to the Apple AppStore",
      "format": "uri"
    },
    "urlGooglePlayStore": {
      "type": "string",
      "description": "link to the Google Play store",
      "format": "uri"
    },
    "urlWebApp": {
      "type": "string",
      "description": "Link to the web app - where the agent can be used with a browser",
      "format": "uri"
    },
    "credentialProfiles": {
      "type": "array",
      "description": "list of supported credential profiles, it has to be a valid credential profile from the Credential Profiles Comparison SIG",
      "$comment": "All values can be found here: https://openwallet-foundation.github.io/credential-format-comparison-sig/#/",
      "items": {
        "$ref": "https://openwallet-foundation.github.io/credential-format-comparison-sig/assets/schemas/fields.json#/definitions/Credential-Profile"
      }
    },
    "credentialFormats": {
      "type": "array",
      "description": "list of supported credential formats, it has to be a valid credential format from the Credential Formats Comparison SIG",
      "$comment": "All values can be found here: https://openwallet-foundation.github.io/credential-format-comparison-sig/#/resources/Credential%20Format",
      "items": {
        "$ref": "https://openwallet-foundation.github.io/credential-format-comparison-sig/assets/schemas/fields.json#/definitions/Credential-Format"
      }
    },
    "signingAlgorithms": {
      "type": "array",
      "description": "list of supported signing algorithms, it has to be a valid credential format from the Credential Formats Comparison SIG",
      "$comment": "All values can be found here: https://openwallet-foundation.github.io/credential-format-comparison-sig/#/resources/Signing%20Algorithm",
      "items": {
        "$ref": "https://openwallet-foundation.github.io/credential-format-comparison-sig/assets/schemas/fields.json#/definitions/Signing-Algorithm"
      }
    },
    "statusManagements": {
      "type": "array",
      "description": "list of supported status algorithms, it has to be a valid credential format from the Credential Formats Comparison SIG",
      "$comment": "All values can be found here: https://openwallet-foundation.github.io/credential-format-comparison-sig/#/resources/Status%20Algorithm",
      "items": {
        "$ref": "https://openwallet-foundation.github.io/credential-format-comparison-sig/assets/schemas/fields.json#/definitions/Status-Algorithm"
      }
    },
    "keyManagements": {
      "type": "array",
      "description": "list of supported key managements, it has to be a valid credential format from the Credential Formats Comparison SIG",
      "$comment": "All values can be found here: https://openwallet-foundation.github.io/credential-format-comparison-sig/#/resources/Key%20Management",
      "items": {
        "$ref": "https://openwallet-foundation.github.io/credential-format-comparison-sig/assets/schemas/fields.json#/definitions/Key-Management"
      }
    },
    "issuanceProtocols": {
      "type": "array",
      "description": "list of supported issuance protocols , it has to be a valid credential format from the Credential Formats Comparison SIG",
      "$comment": "All values can be found here: https://openwallet-foundation.github.io/credential-format-comparison-sig/#/resources/Issuance%20Protocol",
      "items": {
        "$ref": "https://openwallet-foundation.github.io/credential-format-comparison-sig/assets/schemas/fields.json#/definitions/Issuance-Protocol"
      }
    },
    "presentationProtocols": {
      "type": "array",
      "description": "list of supported presentation protocols , it has to be a valid credential format from the Credential Formats Comparison SIG",
      "$comment": "All values can be found here: https://openwallet-foundation.github.io/credential-format-comparison-sig/#/resources/Presentation%20Protocol",
      "items": {
        "$ref": "https://openwallet-foundation.github.io/credential-format-comparison-sig/assets/schemas/fields.json#/definitions/Presentation-Protocol"
      }
    },
    "trustManagements": {
      "type": "array",
      "description": "list of supported trust managements , it has to be a valid credential format from the Credential Formats Comparison SIG",
      "$comment": "All values can be found here: https://openwallet-foundation.github.io/credential-format-comparison-sig/#/resources/Trust%20Management",
      "items": {
        "$ref": "https://openwallet-foundation.github.io/credential-format-comparison-sig/assets/schemas/fields.json#/definitions/Trust-Management"
      }
    }
  },
  "required": ["capability", "company", "name", "urlWebsite"],
  "additionalProperties": false
}
