{
  "capability": ["issuer", "holder", "verifier"],
  "company": "Identry",
  "credentialFormats": ["AnonCred"],
  "credentialProfiles": ["AnonCreds with did:indy"],
  "logo": "logos/identry.png",
  "name": "Identry",
  "openSource": false,
  "$schema": "../viewer/src/assets/schema.json",
  "signingAlgorithms": ["CL"],
  "urlAppStore": "https://apps.apple.com/us/app/identry/id1609224919",
  "urlWebsite": "https://identry.io/"
}
