{
  "capability": ["holder"],
  "company": "Talao",
  "credentialFormats": ["JWT-VC", "LDP-VC"],
  "credentialProfiles": ["EBSI"],
  "downloadSource": "https://github.com/TalaoDAO/talao-wallet",
  "issuanceProtocols": ["OpenID4VCI"],
  "keyManagements": ["did:ebsi", "did:web", "did:key"],
  "license": "Apache 2.0",
  "logo": "logos/talao.png",
  "name": "Talao Wallet",
  "openSource": true,
  "presentationProtocols": ["OpenID4VP"],
  "$schema": "../viewer/src/assets/schema.json",
  "signingAlgorithms": ["ECDSA"],
  "statusManagements": ["Status List 2021"],
  "type": "mobile",
  "urlAppStore": "https://apps.apple.com/app/talao-wallet/id1582183266#?platform=iphone",
  "urlGooglePlayStore": "https://play.google.com/store/apps/details?id=co.talao.wallet",
  "urlWebsite": "https://talao.io/"
}
