{
  "capability": ["holder"],
  "company": "Trinsic",
  "downloadSource": "https://github.com/trinsic-id/wallet-reference-app",
  "logo": "https://ml58lemqnh9a.i.optimole.com/cb:Xgnl.4ea3/w:404/h:116/q:100/f:best/https://trinsic.id/wp-content/uploads/2023/03/Logo-Blue-1024x299.png.png",
  "name": "Trinsic ID",
  "openSource": true,
  "$schema": "../viewer/src/assets/schema.json",
  "type": "mobile",
  "urlAppStore": "https://apps.apple.com/us/app/trinsic-id/id1475160728",
  "urlGooglePlayStore": "https://play.google.com/store/apps/details?id=id.streetcred.apps.mobile",
  "urlWebsite": "https://trinsic.id/an-introduction-to-the-trinsic-wallet/"
}
