{
  "capability": ["holder"],
  "company": "Datakeeper Wallet",
  "credentialFormats": ["LDP-VC"],
  "logo": "logos/datakeeper.png",
  "name": "Datakeeper",
  "openSource": false,
  "$schema": "../viewer/src/assets/schema.json",
  "signingAlgorithms": ["ECDSA"],
  "urlAppStore": "https://apps.apple.com/nl/app/datakeeper/id1546059184",
  "urlGooglePlayStore": "https://play.google.com/store/apps/details?id=nl.rabobank.ida&gl=US",
  "urlWebsite": "https://www.datakeeper.nl/en"
}
