{
  "capability": ["holder"],
  "company": "Blockchain Helix AG",
  "credentialFormats": ["JWT", "JWT-VC"],
  "issuanceProtocols": ["OpenID4VCI", "Issue Credential v2"],
  "keyManagements": ["did:key"],
  "logo": "logos/helix-id.png",
  "name": "helix id",
  "openSource": false,
  "presentationProtocols": ["OpenID4VP"],
  "$schema": "../viewer/src/assets/schema.json",
  "signingAlgorithms": ["BBS+ with public key binding", "ECDSA"],
  "type": "mobile",
  "urlAppStore": "https://apps.apple.com/de/app/helix-id-wallet/id1469238013",
  "urlGooglePlayStore": "https://play.google.com/store/apps/details?id=com.io.helix.id",
  "urlWebsite": "https://helixid.io/"
}
