{
  "capability": ["holder"],
  "company": "Gataca Inc.",
  "credentialFormats": ["LDP-VC", "JWT-VC"],
  "credentialProfiles": ["EBSI"],
  "issuanceProtocols": ["OpenID4VCI"],
  "keyManagements": ["did:key"],
  "logo": "logos/gataca.png",
  "name": "Gataca Wallet",
  "openSource": false,
  "presentationProtocols": ["OpenID4VP"],
  "$schema": "../viewer/src/assets/schema.json",
  "signingAlgorithms": ["EdDSA", "RSA"],
  "type": "mobile",
  "urlAppStore": "https://apps.apple.com/us/app/gataca/id1498607616",
  "urlGooglePlayStore": "https://play.google.com/store/apps/details?id=com.gataca.identity",
  "urlWebsite": "https://gataca.io/products/wallet/"
}
