{
  "capability": ["holder"],
  "company": "iGrant.io",
  "credentialFormats": ["AnonCred"],
  "credentialProfiles": ["AnonCreds with did:indy", "EBSI", "ICAO DTC", "x.509"],
  "issuanceProtocols": ["OpenID4VCI", "Issue Credential v2"],
  "keyManagements": ["did:ebsi", "did:key", "pub key in X.509 cert"],
  "logo": "logos/data-wallet.png",
  "name": "Data Wallet",
  "openSource": false,
  "presentationProtocols": ["OpenID4VP"],
  "$schema": "../viewer/src/assets/schema.json",
  "signingAlgorithms": ["CL", "ECDSA"],
  "statusManagements": ["Indy Revocation", "Status List 2021"],
  "type": "mobile",
  "urlAppStore": "https://apple.co/2Mz9nJp",
  "urlGooglePlayStore": "https://play.google.com/store/apps/details?id=io.igrant.mobileagent",
  "urlWebApp": "https://business.igrant.io/",
  "urlWebsite": "https://igrant.io/datawallet.html"
}
