{
  "capability": ["holder"],
  "company": "KayTrust",
  "contact": "did@emeal.nttdata.com",
  "logo": "logos/kaytrust-wallet.png",
  "name": "KayTrust Wallet",
  "openSource": false,
  "$schema": "../viewer/src/assets/schema.json",
  "type": "mobile",
  "urlAppStore": "https://apps.apple.com/us/app/mytrust-wallet/id1477073898",
  "urlGooglePlayStore": "https://play.google.com/store/apps/details?id=com.everis.mytrust.app",
  "urlWebsite": "https://kaytrust.id/"
}
