{
  "capability": ["holder"],
  "company": "Cleverbase",
  "credentialFormats": ["x509", "JWT"],
  "contact": "klantenservice@vidua.nl",
  "issuanceProtocols": ["OpenID4VCI"],
  "logo": "logos/vidua.png",
  "name": "Vidua",
  "openSource": false,
  "portability": false,
  "presentationProtocols": ["OpenID4VP"],
  "$schema": "../viewer/src/assets/schema.json",
  "signingAlgorithms": ["ECDSA", "RSA"],
  "type": "mobile",
  "urlAppStore": "https://apps.apple.com/en/app/vidua/id6443842104",
  "urlGooglePlayStore": "https://play.google.com/store/apps/details?id=nl.vidua.wallet",
  "urlWebsite": "https://vidua.nl/english/"
}
